{
  "success": true,
  "original_recipe": {
    "name": "Chocolate Layer Cake",
    "ingredients": [
      {
        "name": "all-purpose flour",
        "amount": "2 1/4",
        "quantity": 2.25,
        "unit": "cup"
      },
      {
        "name": "granulated sugar",
        "amount": "2",
        "quantity": 2.0,
        "unit": "cup"
      },
      {
        "name": "unsweetened cocoa powder",
        "amount": "3/4",
        "quantity": 0.75,
        "unit": "cup"
      },
      {
        "name": "baking powder",
        "amount": "1 1/2",
        "quantity": 1.5,
        "unit": "tsp"
      },
      {
        "name": "baking soda",
        "amount": "1 1/2",
        "quantity": 1.5,
        "unit": "tsp"
      },
      {
        "name": "salt",
        "amount": "1",
        "quantity": 1.0,
        "unit": "tsp"
      },
      {
        "name": "eggs",
        "amount": "2",
        "quantity": 2.0,
        "unit": "large"
      },
      {
        "name": "milk",
        "amount": "1",
        "quantity": 1.0,
        "unit": "cup"
      },
      {
        "name": "vegetable oil",
        "amount": "1/2",
        "quantity": 0.5,
        "unit": "cup"
      },
      {
        "name": "vanilla extract",
        "amount": "2",
        "quantity": 2.0,
        "unit": "tsp"
      },
      {
        "name": "boiling water",
        "amount": "1",
        "quantity": 1.0,
        "unit": "cup"
      },
      {
        "name": "butter, softened",
        "amount": "1/2",
        "quantity": 0.5,
        "unit": "cup"
      },
      {
        "name": "unsweetened cocoa powder",
        "amount": "2/3",
        "quantity": 0.6666666666666666,
        "unit": "cup"
      },
      {
        "name": "powdered sugar",
        "amount": "3",
        "quantity": 3.0,
        "unit": "cup"
      },
      {
        "name": "milk",
        "amount": "1/3",
        "quantity": 0.3333333333333333,
        "unit": "cup"
      },
      {
        "name": "vanilla extract",
        "amount": "1",
        "quantity": 1.0,
        "unit": "tsp"
      }
    ],
    "instructions": "1. Preheat oven to 350\u00b0F (175\u00b0C).\n2. Grease and flour two 9-inch round cake pans.\n3. In a large bowl, mix flour, sugar, cocoa, baking powder, baking soda, and salt.\n4. Add eggs, milk, oil, and vanilla. Beat for 2 minutes.\n5. Stir in boiling water (batter will be thin).\n6. Pour into prepared pans.\n7. Bake for 30-35 minutes until toothpick comes out clean.\n8. Cool in pans for 10 minutes, then remove to wire racks.\n9. For frosting, beat butter and cocoa until smooth.\n10. Gradually beat in powdered sugar, milk, and vanilla.\n11. Frost cooled cake layers.",
    "servings": 12
  },
  "dietary_restrictions": [
    "vegan"
  ],
  "recipe_context": {
    "recipe_type": "baking",
    "cooking_method": "baking",
    "flavor_profile": "sweet"
  },
  "substitutions": [],
  "unchanged_ingredients": [],
  "total_substitutions": 0,
  "agent_reasoning": "LLM agent created a complete cookbook-style recipe",
  "cookbook_recipe": "\n# Vegan Chocolate Layer Cake\n\n**Ingredients:**\n\n- 2 1/4 cup all-purpose flour\n- 2 cup granulated sugar\n- 3/4 cup unsweetened cocoa powder\n- 1 1/2 tsp baking powder\n- 1 1/2 tsp baking soda\n- 1 tsp salt\n- 2 large flax egg\n- 1 cup oat milk\n- 1/2 cup vegetable oil\n- 2 tsp vanilla extract\n- 1 cup boiling water\n- 1/2 cup None\n- 2/3 cup unsweetened cocoa powder\n- 3 cup powdered sugar\n- 1/3 cup oat milk\n- 1 tsp vanilla extract\n\n\n**Instructions:**\n\n1. Preheat oven to 350\u00b0F (175\u00b0C).\n2. Grease and flour two 9-inch round cake pans.\n3. In a large bowl, mix flour, sugar, cocoa, baking powder, baking soda, and salt.\n4. Add eggs, milk, oil, and vanilla. Beat for 2 minutes.\n5. Stir in boiling water (batter will be thin).\n6. Pour into prepared pans.\n7. Bake for 30-35 minutes until toothpick comes out clean.\n8. Cool in pans for 10 minutes, then remove to wire racks.\n9. For frosting, beat butter and cocoa until smooth.\n10. Gradually beat in powdered sugar, milk, and vanilla.\n11. Frost cooled cake layers.\n\n**Notes:**\n\n"
}